{
  "schemaVersion": "1.0.0",
  "id": "report-workspace-tabs",
  "title": "Report Workspace Tabs",
  "description": "A responsive, scrollable tab rail for switching analytical report views.",
  "category": "reporting",
  "maturity": "beta",
  "kind": "recipe",
  "searchTerms": ["report", "tabs", "workspace", "analytics", "scrollable navigation"],
  "fixture": "recipes/report-workspace-tabs/fixtures/basic.json",
  "documentation": "recipes/report-workspace-tabs/README.md",
  "scenarios": [
    {
      "id": "default",
      "title": "Six report views",
      "fixture": "recipes/report-workspace-tabs/fixtures/basic.json",
      "states": ["active", "optional"],
      "defaultViewport": "768"
    }
  ],
  "react": {
    "files": ["recipes/report-workspace-tabs/react/ReportWorkspaceTabs.tsx"],
    "entry": "recipes/report-workspace-tabs/react/ReportWorkspaceTabs.tsx",
    "export": "ReportWorkspaceTabsPreview",
    "exampleData": "recipes/report-workspace-tabs/fixtures/basic.json"
  },
  "blade": {
    "files": ["recipes/report-workspace-tabs/blade/report-workspace-tabs.blade.php"],
    "exampleData": "recipes/report-workspace-tabs/fixtures/basic.json",
    "events": ["ui:report-workspace-tabs:change"]
  },
  "contract": {
    "support": "composition-recipe",
    "standaloneApi": false,
    "fixturePolicy": "neutral DTOs only",
    "hostResponsibilities": ["Render report panels", "Own lazy loading and URL state", "Apply permissions before supplying tabs", "Explain unavailable views", "Own export actions"],
    "inputs": [
      { "name": "tabs", "type": "ReportWorkspaceTab[]", "required": true },
      { "name": "value", "type": "string", "required": true },
      { "name": "renderPanel", "type": "(tab: ReportWorkspaceTab) => ReactNode", "required": true }
    ],
    "callbacks": [
      { "name": "onValueChange", "type": "(value: string) => void", "required": true }
    ]
  },
  "dependencies": {
    "internal": ["badge", "tabs"],
    "npm": ["react@18.3.1"],
    "bladeRuntime": ["Alpine.js 3"]
  },
  "responsiveBehavior": ["The tab list scrolls horizontally and keeps intrinsic trigger widths", "The active tab scrolls into view", "Panel layout remains host-controlled"],
  "accessibility": {
    "status": "passed-with-findings",
    "findings": ["Host-provided disabled tabs require an adjacent explanation rather than relying on disabled state alone."]
  },
  "parity": {
    "classification": "framework-equivalent",
    "differences": ["React accepts a renderPanel function; Blade composes panel markup through server-rendered tab data or slots."]
  },
  "source": {
    "commit": "d1511e224305585680723101a0b76be93eb9f2f0",
    "verifiedAt": "2026-08-04",
    "files": [
      { "path": "src/app/pages/Reporting.tsx", "sha256": "08d14439134b2f9e390179370c7547c5635deea67246acd663bb5383c3be3f8e" },
      { "path": "_style-reference/multi-channel-sales-platform-main 2/resources/views/reporting/index.blade.php", "sha256": "08ecd8d57f479a931f5cf54c1663b21d5f6a10def9d57be1674ff1891a83d643" }
    ],
    "decisionReferences": ["approved-plan#reporting"]
  }
}
