{
  "schemaVersion": "1.0.0",
  "id": "kpi-stat-grid",
  "title": "KPI Stat Grid",
  "description": "Responsive report summary cards with machine-safe values and host-supplied trends.",
  "category": "reporting",
  "maturity": "beta",
  "kind": "recipe",
  "searchTerms": ["report", "kpi", "stat", "metric", "summary", "trend"],
  "fixture": "recipes/kpi-stat-grid/fixtures/basic.json",
  "documentation": "recipes/kpi-stat-grid/README.md",
  "scenarios": [
    {
      "id": "default",
      "title": "Four report metrics",
      "fixture": "recipes/kpi-stat-grid/fixtures/basic.json",
      "states": ["positive trend", "flat trend", "no trend"],
      "defaultViewport": "1280"
    }
  ],
  "react": {
    "files": ["recipes/kpi-stat-grid/react/KpiStatGrid.tsx"],
    "entry": "recipes/kpi-stat-grid/react/KpiStatGrid.tsx",
    "export": "KpiStatGridPreview",
    "exampleData": "recipes/kpi-stat-grid/fixtures/basic.json"
  },
  "blade": {
    "files": ["recipes/kpi-stat-grid/blade/kpi-stat-grid.blade.php"],
    "exampleData": "recipes/kpi-stat-grid/fixtures/basic.json"
  },
  "contract": {
    "support": "composition-recipe",
    "standaloneApi": false,
    "fixturePolicy": "neutral DTOs only",
    "hostResponsibilities": ["Aggregate every metric", "Format display values for the active locale", "Supply minor-unit money and currency codes", "Compute comparison trends", "Update the metric set atomically"],
    "inputs": [
      { "name": "metrics", "type": "KpiMetric[]", "required": true },
      { "name": "label", "type": "string", "required": false }
    ]
  },
  "dependencies": {
    "internal": ["badge", "card"],
    "npm": ["lucide-react@0.487.0", "react@18.3.1"],
    "bladeRuntime": ["Phosphor Icons for Blade"]
  },
  "responsiveBehavior": ["Metrics use two columns at narrow widths and four at large widths", "Trend copy wraps inside its own card", "Tabular numerals preserve alignment as values change"],
  "accessibility": {
    "status": "passed-with-findings",
    "findings": ["Dynamic hosts should announce refreshed report status once, outside the metric grid, to avoid four simultaneous live-region updates."]
  },
  "parity": {
    "classification": "framework-equivalent",
    "differences": ["React uses Lucide glyphs and Blade uses semantically matched Phosphor glyphs."]
  },
  "source": {
    "commit": "d1511e224305585680723101a0b76be93eb9f2f0",
    "verifiedAt": "2026-08-04",
    "files": [
      { "path": "src/app/pages/Reporting.tsx", "sha256": "08d14439134b2f9e390179370c7547c5635deea67246acd663bb5383c3be3f8e" },
      { "path": "_style-reference/multi-channel-sales-platform-main 2/resources/views/reporting/index.blade.php", "sha256": "08ecd8d57f479a931f5cf54c1663b21d5f6a10def9d57be1674ff1891a83d643" }
    ],
    "decisionReferences": ["approved-plan#reporting"]
  }
}
