{
  "schemaVersion": "1.0.0",
  "id": "grouped-results-table",
  "title": "Grouped Results Table",
  "description": "A host-aggregated results table with groups, subtotals, totals and empty state.",
  "category": "reporting",
  "maturity": "beta",
  "kind": "recipe",
  "searchTerms": ["report", "results", "table", "group by", "subtotal", "transactions"],
  "fixture": "recipes/grouped-results-table/fixtures/basic.json",
  "documentation": "recipes/grouped-results-table/README.md",
  "scenarios": [
    { "id": "grouped", "title": "Grouped by seller", "fixture": "recipes/grouped-results-table/fixtures/basic.json", "states": ["grouped", "subtotals", "grand total"], "defaultViewport": "1280" },
    { "id": "empty", "title": "No matching rows", "fixture": "recipes/grouped-results-table/fixtures/empty.json", "states": ["empty"], "defaultViewport": "768" }
  ],
  "react": {
    "files": ["recipes/grouped-results-table/react/GroupedResultsTable.tsx"],
    "entry": "recipes/grouped-results-table/react/GroupedResultsTable.tsx",
    "export": "GroupedResultsTablePreview",
    "exampleData": "recipes/grouped-results-table/fixtures/basic.json"
  },
  "blade": {
    "files": ["recipes/grouped-results-table/blade/grouped-results-table.blade.php"],
    "exampleData": "recipes/grouped-results-table/fixtures/basic.json",
    "events": ["ui:grouped-results-table:change"]
  },
  "contract": {
    "support": "composition-recipe",
    "standaloneApi": false,
    "fixturePolicy": "neutral DTOs only",
    "hostResponsibilities": ["Fetch and paginate records", "Group and sort rows", "Calculate all financial values and totals", "Format cell display values", "Authorise columns and records", "Own export actions"],
    "inputs": [
      { "name": "columns", "type": "ResultColumn[]", "required": true },
      { "name": "groups", "type": "ReportResultGroup[]", "required": true },
      { "name": "groupBy", "type": "string", "required": true },
      { "name": "grandTotal", "type": "Record<string, ResultCell>", "required": false }
    ],
    "callbacks": [
      { "name": "onGroupByChange", "type": "(value: string) => void", "required": true }
    ]
  },
  "dependencies": {
    "internal": ["badge", "card", "label", "select", "table"],
    "npm": ["react@18.3.1"],
    "bladeRuntime": ["Alpine.js 3"]
  },
  "responsiveBehavior": ["The table scrolls horizontally inside its card", "Grouping controls wrap above the table", "No data column is silently removed at phone widths"],
  "accessibility": {
    "status": "passed-with-findings",
    "findings": ["Very wide consumer schemas must be tested with screen magnification and table navigation in the destination."]
  },
  "parity": {
    "classification": "framework-equivalent",
    "differences": ["The preview swaps fixture-provided grouped views locally; production grouping remains host-owned in both frameworks."]
  },
  "source": {
    "commit": "d1511e224305585680723101a0b76be93eb9f2f0",
    "verifiedAt": "2026-08-04",
    "files": [
      { "path": "src/app/pages/Reporting.tsx", "sha256": "08d14439134b2f9e390179370c7547c5635deea67246acd663bb5383c3be3f8e" },
      { "path": "_style-reference/multi-channel-sales-platform-main 2/resources/views/reporting/partials/list.blade.php", "sha256": "845339ae65d362ff6f8fb636ae00907ed175b773a38f6c54e383ea75c3cee8ba" }
    ],
    "decisionReferences": ["approved-plan#reporting", "provenance/decisions.md#host-owned-reporting-behavior"]
  }
}
