{
  "schemaVersion": "1.0.0",
  "id": "capacity-product-selector",
  "title": "Capacity Product Selector",
  "description": "Expandable products with tier quantities and party-capacity feedback.",
  "category": "booking",
  "maturity": "beta",
  "kind": "recipe",
  "searchTerms": ["booking", "product", "capacity", "tier", "quantity", "coverage"],
  "fixture": "recipes/capacity-product-selector/fixtures/basic.json",
  "documentation": "recipes/capacity-product-selector/README.md",
  "scenarios": [{ "id": "basic", "title": "Under-covered party", "fixture": "recipes/capacity-product-selector/fixtures/basic.json", "states": ["expanded", "under-covered", "quantity-only"], "defaultViewport": "768" }],
  "react": { "files": ["recipes/capacity-product-selector/react/CapacityProductSelector.tsx"], "entry": "recipes/capacity-product-selector/react/CapacityProductSelector.tsx", "export": "CapacityProductSelectorPreview", "exampleData": "recipes/capacity-product-selector/fixtures/basic.json" },
  "blade": { "files": ["recipes/capacity-product-selector/blade/capacity-product-selector.blade.php"], "exampleData": "recipes/capacity-product-selector/fixtures/basic.json", "events": ["ui:capacity-product-selector:change"] },
  "contract": {
    "support": "composition-recipe", "standaloneApi": false, "fixturePolicy": "neutral DTOs only",
    "hostResponsibilities": ["Apply eligibility, allocation, stock, pricing, and persistence rules", "Validate submitted product and tier IDs"],
    "inputs": [{ "name": "products", "type": "CapacityProduct[]", "required": true }, { "name": "selectedProductIds", "type": "string[]", "required": true }, { "name": "selections", "type": "CapacityProductSelection[]", "required": true }, { "name": "targetCapacity", "type": "number", "required": true }],
    "callbacks": [{ "name": "onToggleProduct", "type": "(productId: string, included: boolean) => void", "required": true }, { "name": "onLinesChange", "type": "(productId: string, lines: CapacityTierLine[]) => void", "required": true }]
  },
  "dependencies": { "internal": ["badge", "button", "select", "stepper"], "npm": ["lucide-react@0.487.0"], "bladeRuntime": ["Alpine.js 3", "Alpine Collapse", "Phosphor Icons"] },
  "responsiveBehavior": ["Tier label, quantity, and removal controls share one compact row down to 360px.", "Expanded content grows vertically without changing the surrounding page width."],
  "accessibility": { "status": "passed-with-findings", "findings": ["React passed isolated light/dark axe scans, including independently cleared OKLCH contrast results. Hosts that add or remove product lines asynchronously must preserve a useful focus position and announce material coverage changes."] },
  "parity": { "classification": "intentional-difference", "differences": ["Blade uses a styled native select and inline quantity controls inside Alpine-generated rows; React composes Select and Stepper primitives.", "Icon paths differ between Lucide and Phosphor."] },
  "source": { "commit": "d1511e224305585680723101a0b76be93eb9f2f0", "verifiedAt": "2026-08-04", "files": [{ "path": "src/app/epos/components/TourCard.tsx", "sha256": "db1e2d82bcd51a29f194824a17d4b85e94d7314b87cf431b02c6dfdf2463de7c" }, { "path": "src/app/epos/components/Step1.tsx", "sha256": "3dd0de790718105d38a02b03b86bcdc7081173219d534b249e53537e7bcbbf6e" }, { "path": "_style-reference/multi-channel-sales-platform-main 2/resources/views/booking/epos.blade.php", "sha256": "12c86cb1fe6cb7ec963714322da14e732e8544e61fb731ad3be709095691dfd1" }, { "path": "_style-reference/multi-channel-sales-platform-main 2/public/js/booking/epos.js", "sha256": "94fc9e33bb13e6cf999cf32a34bd8a102f2f59625f9e5a6d597a0156e693f3b3" }], "decisionReferences": ["provenance/decisions.md#approved-pattern-catalogue"] }
}
