{
  "schemaVersion": "1.0.0",
  "id": "report-breakdown-table",
  "title": "Report Breakdown Table",
  "description": "A host-aggregated hierarchy of reporting groups, child items and totals.",
  "category": "reporting",
  "maturity": "beta",
  "kind": "recipe",
  "searchTerms": ["report", "breakdown", "product", "hierarchy", "group", "table"],
  "fixture": "recipes/report-breakdown-table/fixtures/basic.json",
  "documentation": "recipes/report-breakdown-table/README.md",
  "scenarios": [
    { "id": "product", "title": "Product hierarchy", "description": "Three product groups with host-calculated child and total rows.", "fixture": "recipes/report-breakdown-table/fixtures/basic.json", "states": ["group totals", "child rows", "grand total"], "defaultViewport": "1280" }
  ],
  "react": {
    "files": ["recipes/report-breakdown-table/react/ReportBreakdownTable.tsx"],
    "entry": "recipes/report-breakdown-table/react/ReportBreakdownTable.tsx",
    "export": "ReportBreakdownTablePreview",
    "exampleData": "recipes/report-breakdown-table/fixtures/basic.json"
  },
  "blade": {
    "files": ["recipes/report-breakdown-table/blade/report-breakdown-table.blade.php"],
    "exampleData": "recipes/report-breakdown-table/fixtures/basic.json"
  },
  "contract": {
    "support": "composition-recipe",
    "standaloneApi": false,
    "fixturePolicy": "neutral DTOs only",
    "hostResponsibilities": ["Aggregate and order groups and items", "Calculate totals and averages", "Format all display values", "Supply minor-unit money and currency codes", "Render and label any chart slot", "Authorise the underlying records"],
    "inputs": [
      { "name": "groups", "type": "BreakdownGroup[]", "required": true },
      { "name": "columns", "type": "BreakdownColumn[]", "required": true },
      { "name": "total", "type": "Record<string, BreakdownValue>", "required": false },
      { "name": "visualisation", "type": "ReactNode | Blade slot", "required": false }
    ]
  },
  "dependencies": {
    "internal": ["card", "table"],
    "npm": ["react@18.3.1"],
    "bladeRuntime": []
  },
  "responsiveBehavior": ["The full hierarchy scrolls horizontally inside the card", "Child indentation remains visible at all widths", "A host visualisation stacks above the table"],
  "accessibility": {
    "status": "passed-with-findings",
    "findings": ["A host chart slot must provide its own accessible name and must not claim the table as an equivalent unless both contain identical values."]
  },
  "parity": {
    "classification": "framework-equivalent",
    "differences": ["React supplies host visualisation content as ReactNode; Blade supplies it as a named slot."]
  },
  "source": {
    "commit": "d1511e224305585680723101a0b76be93eb9f2f0",
    "verifiedAt": "2026-08-04",
    "files": [
      { "path": "src/app/pages/Reporting.tsx", "sha256": "08d14439134b2f9e390179370c7547c5635deea67246acd663bb5383c3be3f8e" },
      { "path": "_style-reference/multi-channel-sales-platform-main 2/resources/views/reporting/index.blade.php", "sha256": "08ecd8d57f479a931f5cf54c1663b21d5f6a10def9d57be1674ff1891a83d643" }
    ],
    "decisionReferences": ["approved-plan#reporting", "provenance/decisions.md#chart-slots"]
  }
}
